{
  "$schema": "./sounds.schema.json",
  "version": 1,
  "generated": "2026-10-18",
  "sources": {
    "readme-ios7": "README.md \"List of SystemSoundIDs\" table (collected on iOS 7)",
    "p-x9": "https://github.com/p-x9/swift-system-sound/blob/e3f44c2d5766b0a7c3cdaacd4d61b5e1c8804794/SystemSoundTable.md (MIT, Copyright (c) 2023 p-x9)",
    "onj-dump": "https://3.onj.me/phonetones/unzipped/Apple/iOS-26/System/Library/Audio/UISounds/ (file exists in the iOS 26 filesystem dump)"
  },
  "sounds": [
    {
      "id": 30,
      "name": "inCallSystemSoundRingbackToneAnsi",
      "file": "ringback_tone_ansi.caf",
      "folder": "nano",
      "path": "/System/Library/Audio/UISounds/nano/ringback_tone_ansi.caf",
      "category": "InCallSystemSound",
      "minIOS": null,
      "status": "current",
      "confidence": "medium",
      "source": [
        "p-x9",
        "onj-dump"
      ],
      "ios7": null,
      "notes": null
    },
    {
      "id": 31,
      "name": "inCallSystemSoundRingbackToneCept",
      "file": "ringback_tone_cept.caf",
      "folder": "nano",
      "path": "/System/Library/Audio/UISounds/nano/ringback_tone_cept.caf",
      "category": "InCallSystemSound",
      "minIOS": null,
      "status": "current",
      "confidence": "medium",
      "source": [
        "p-x9",
        "onj-dump"
      ],
      "ios7": null,
      "notes": null
    },
    {
      "id": 32,
      "name": "inCallSystemSoundBusyToneAnsi",
      "file": "busy_tone_ansi.caf",
      "folder": "nano",
      "path": "/System/Library/Audio/UISounds/nano/busy_tone_ansi.caf",
      "category": "InCallSystemSound",
      "minIOS": null,
      "status": "current",
      "confidence": "medium",
      "source": [
        "p-x9",
        "onj-dump"
      ],
      "ios7": null,
      "notes": null
    },
    {
      "id": 33,
      "name": "inCallSystemSoundBusyToneCept",
      "file": "busy_tone_cept.caf",
      "folder": "nano",
      "path": "/System/Library/Audio/UISounds/nano/busy_tone_cept.caf",
      "category": "InCallSystemSound",
      "minIOS": null,
      "status": "current",
      "confidence": "medium",
      "source": [
        "p-x9",
        "onj-dump"
      ],
      "ios7": null,
      "notes": null
    },
    {
      "id": 34,
      "name": "inCallSystemSoundCallWaitingToneAnsi",
      "file": "call_waiting_tone_ansi.caf",
      "folder": "nano",
      "path": "/System/Library/Audio/UISounds/nano/call_waiting_tone_ansi.caf",
      "category": "InCallSystemSound",
      "minIOS": null,
      "status": "current",
      "confidence": "medium",
      "source": [
        "p-x9",
        "onj-dump"
      ],
      "ios7": null,
      "notes": null
    },
    {
      "id": 35,
      "name": "inCallSystemSoundCallWaitingToneCept",
      "file": "call_waiting_tone_cept.caf",
      "folder": "nano",
      "path": "/System/Library/Audio/UISounds/nano/call_waiting_tone_cept.caf",
      "category": "InCallSystemSound",
      "minIOS": null,
      "status": "current",
      "confidence": "medium",
      "source": [
        "p-x9",
        "onj-dump"
      ],
      "ios7": null,
      "notes": null
    },
    {
      "id": 36,
      "name": "endOfCallToneCEPT",
      "file": "end_call_tone_cept.caf",
      "folder": "nano",
      "path": "/System/Library/Audio/UISounds/nano/end_call_tone_cept.caf",
      "category": "EndOfCallTone_CEPT(iOS26~) InCallSystemSound(~iOS18)",
      "minIOS": null,
      "status": "current",
      "confidence": "medium",
      "source": [
        "p-x9",
        "onj-dump"
      ],
      "ios7": null,
      "notes": null
    },
    {
      "id": 37,
      "name": "inCallSystemSoundRingbackToneHk",
      "file": "ringback_tone_hk.caf",
      "folder": "nano",
      "path": "/System/Library/Audio/UISounds/nano/ringback_tone_hk.caf",
      "category": "InCallSystemSound",
      "minIOS": null,
      "status": "current",
      "confidence": "medium",
      "source": [
        "p-x9",
        "onj-dump"
      ],
      "ios7": null,
      "notes": null
    },
    {
      "id": 38,
      "name": "inCallSystemSoundRingbackToneAus",
      "file": "ringback_tone_aus.caf",
      "folder": "nano",
      "path": "/System/Library/Audio/UISounds/nano/ringback_tone_aus.caf",
      "category": "InCallSystemSound",
      "minIOS": null,
      "status": "current",
      "confidence": "medium",
      "source": [
        "p-x9",
        "onj-dump"
      ],
      "ios7": null,
      "notes": null
    },
    {
      "id": 39,
      "name": "inCallSystemSoundRingbackToneUk",
      "file": "ringback_tone_uk.caf",
      "folder": "nano",
      "path": "/System/Library/Audio/UISounds/nano/ringback_tone_uk.caf",
      "category": "InCallSystemSound",
      "minIOS": null,
      "status": "current",
      "confidence": "medium",
      "source": [
        "p-x9",
        "onj-dump"
      ],
      "ios7": null,
      "notes": null
    },
    {
      "id": 1000,
      "name": "mailReceived",
      "file": "new-mail.caf",
      "folder": "",
      "path": "/System/Library/Audio/UISounds/new-mail.caf",
      "category": "MailReceived",
      "minIOS": null,
      "status": "current",
      "confidence": "high",
      "source": [
        "readme-ios7",
        "p-x9",
        "onj-dump"
      ],
      "ios7": {
        "file": "new-mail.caf",
        "category": "MailReceived"
      },
      "notes": null
    },
    {
      "id": 1001,
      "name": "mailSentMailSent",
      "file": "mail-sent.caf",
      "folder": "",
      "path": "/System/Library/Audio/UISounds/mail-sent.caf",
      "category": "MailSent",
      "minIOS": null,
      "status": "current",
      "confidence": "high",
      "source": [
        "readme-ios7",
        "p-x9",
        "onj-dump"
      ],
      "ios7": {
        "file": "mail-sent.caf",
        "category": "MailSent"
      },
      "notes": null
    },
    {
      "id": 1002,
      "name": "voicemailReceived",
      "file": "sms-received1.caf",
      "folder": "nano",
      "path": "/System/Library/Audio/UISounds/nano/sms-received1.caf",
      "category": "VoicemailReceived",
      "minIOS": null,
      "status": "changed-since-ios7",
      "confidence": "low",
      "source": [
        "readme-ios7",
        "p-x9",
        "onj-dump"
      ],
      "ios7": {
        "file": "Voicemail.caf",
        "category": "VoicemailReceived"
      },
      "notes": "iOS 7 table maps this ID to Voicemail.caf; p-x9 maps it to sms-received1.caf. Verify on device. The iOS 7 file Voicemail.caf no longer exists (iOS 17-27 dumps)."
    },
    {
      "id": 1003,
      "name": "smsReceived",
      "file": "ReceivedMessage.caf",
      "folder": "",
      "path": "/System/Library/Audio/UISounds/ReceivedMessage.caf",
      "category": "SMSReceived",
      "minIOS": null,
      "status": "current",
      "confidence": "high",
      "source": [
        "readme-ios7",
        "p-x9",
        "onj-dump"
      ],
      "ios7": {
        "file": "ReceivedMessage.caf",
        "category": "SMSReceived"
      },
      "notes": null
    },
    {
      "id": 1004,
      "name": "smsSent",
      "file": "SentMessage.caf",
      "folder": "",
      "path": "/System/Library/Audio/UISounds/SentMessage.caf",
      "category": "SMSSent",
      "minIOS": null,
      "status": "current",
      "confidence": "high",
      "source": [
        "readme-ios7",
        "p-x9",
        "onj-dump"
      ],
      "ios7": {
        "file": "SentMessage.caf",
        "category": "SMSSent"
      },
      "notes": null
    },
    {
      "id": 1005,
      "name": "calendarAlert",
      "file": "alarm.caf",
      "folder": "",
      "path": "/System/Library/Audio/UISounds/alarm.caf",
      "category": "CalendarAlert",
      "minIOS": null,
      "status": "current",
      "confidence": "high",
      "source": [
        "readme-ios7",
        "p-x9",
        "onj-dump"
      ],
      "ios7": {
        "file": "alarm.caf",
        "category": "CalendarAlert"
      },
      "notes": null
    },
    {
      "id": 1006,
      "name": "lowPower",
      "file": "low_power.caf",
      "folder": "",
      "path": "/System/Library/Audio/UISounds/low_power.caf",
      "category": "LowPower",
      "minIOS": null,
      "status": "current",
      "confidence": "high",
      "source": [
        "readme-ios7",
        "p-x9",
        "onj-dump"
      ],
      "ios7": {
        "file": "low_power.caf",
        "category": "LowPower"
      },
      "notes": null
    },
    {
      "id": 1007,
      "name": "smsReceivedAlertSmsReceived1",
      "file": "sms-received1.caf",
      "folder": "nano",
      "path": "/System/Library/Audio/UISounds/nano/sms-received1.caf",
      "category": "SMSReceived_Alert",
      "minIOS": null,
      "status": "current",
      "confidence": "high",
      "source": [
        "readme-ios7",
        "p-x9",
        "onj-dump"
      ],
      "ios7": {
        "file": "sms-received1.caf",
        "category": "SMSReceived_Alert"
      },
      "notes": null
    },
    {
      "id": 1008,
      "name": "smsReceivedAlertSmsReceived2",
      "file": "sms-received2.caf",
      "folder": "",
      "path": "/System/Library/Audio/UISounds/sms-received2.caf",
      "category": "SMSReceived_Alert",
      "minIOS": null,
      "status": "current",
      "confidence": "high",
      "source": [
        "readme-ios7",
        "p-x9",
        "onj-dump"
      ],
      "ios7": {
        "file": "sms-received2.caf",
        "category": "SMSReceived_Alert"
      },
      "notes": null
    },
    {
      "id": 1009,
      "name": "smsReceivedAlertSmsReceived3",
      "file": "sms-received3.caf",
      "folder": "",
      "path": "/System/Library/Audio/UISounds/sms-received3.caf",
      "category": "SMSReceived_Alert",
      "minIOS": null,
      "status": "current",
      "confidence": "high",
      "source": [
        "readme-ios7",
        "p-x9",
        "onj-dump"
      ],
      "ios7": {
        "file": "sms-received3.caf",
        "category": "SMSReceived_Alert"